Top K Elements,,,,"Kth Largest Element in a Stream (Coding%20Problems/Kth%20Largest%20Element%20in%20a%20Stream%20e918ffeeaf9f4641a37d3f2c4daae400.html), Reorganize String (Coding%20Problems/Reorganize%20String%20a9b60e21897a47669fa814cb5a27dbe2.html), Top K Frequent Elements (Coding%20Problems/Top%20K%20Frequent%20Elements%20cf4b14e0bda045b9bd617eda444e51de.html)",,"July 2, 2024 12:27 AM",,,"Which data structure can we use to solve such problems? 

A heap is the best data structure to keep track of the smallest or largest k elements. 

With this pattern, we either use a max heap or a min heap to find the smallest or largest k elements, respectively, because they allow us to efficiently maintain a collection of elements ordered in a way that gives us quick access to the smallest (min heap) or largest (max heap) element.","October 23, 2024 2:08 PM",,,Not started,Not started,,,,"The top k elements pattern is an important technique in coding that helps us efficiently find a specific number of elements, known as k, from a set of data. This is particularly useful when we’re tasked with identifying the largest, smallest, or most/least frequent elements within an unsorted collection.",
Two Heaps,,,,"Schedule Tasks on Minimum Machines (Coding%20Problems/Schedule%20Tasks%20on%20Minimum%20Machines%2007c48a8895c34c93a33487536531e0d7.html), Maximize Capital (Coding%20Problems/Maximize%20Capital%20efa756a09e00436080a1e6d02467a844.html), Find Median from a Data Stream (Coding%20Problems/Find%20Median%20from%20a%20Data%20Stream%200a73058675744785bb50531d299d618e.html)",,"July 3, 2024 12:11 AM",,https://www.educative.io/module/page/jvPPvMJ2Z8LsZol1rNNRXK/5864882417434624/5917419999723520/6103677027876864,,"October 23, 2024 2:07 PM",,,Not started,Not started,,,,"The two heaps pattern is a versatile and efficient approach used to solve problems involving dynamic data processing, optimization, and real-time analysis. As the name suggests, this pattern maintains two heaps, which could be either two min heaps, two max heaps, or a min heap and a max heap.",
Greedy Techniques,"Imagine being at a buffet, and we want to fill the plate with the most satisfying combination of dishes available, but there’s a catch: we can only make our choice one dish at a time, and once we move past a dish, we can’t go back to pick it up. In this scenario, a greedy approach would be to always choose the dish that looks most appealing to us at each step, hoping that we end up with the best possible meal.",,,"Jump Game I (Coding%20Problems/Jump%20Game%20I%208a1670b155474366beb8b7cfb1d3f194.html), Boats to Save People (Coding%20Problems/Boats%20to%20Save%20People%20fb303857605a46e2bae6e99977b3293a.html), Gas Stations (Coding%20Problems/Gas%20Stations%20f01cc27f65d64bee8573635c5c8bafa3.html), Minimum Number of Refueling Stops (Coding%20Problems/Minimum%20Number%20of%20Refueling%20Stops%20f2f07fa67e0b44fa8025d9f23009885c.html)",,"July 3, 2024 2:44 PM",,https://www.educative.io/module/page/jvPPvMJ2Z8LsZol1rNNRXK/5864882417434624/5917419999723520/5505617209982976,,"October 23, 2024 3:42 PM",,,Not started,Not started,,,,"greedy algorithms are an approach for tackling optimization problems where we aim to find the best solution under given constraints.

",
Sliding Window,"Imagine you’re in a long hallway lined with paintings, and you’re looking through a narrow frame that only reveals a portion of this hallway at any time. 

As you move the frame along the hallway, new paintings come into view while others leave the frame. 

This process of moving and adjusting what’s visible through the frame is akin to how the sliding window technique operates over data.",,,"Repeated DNA Sequences (Coding%20Problems/Repeated%20DNA%20Sequences%20c8c9bd626fc842d7b6ab48d64e290a63.html), Longest Repeating Character Replacement (Coding%20Problems/Longest%20Repeating%20Character%20Replacement%207ffc6290370d4084bcbcc0344b5ef9d6.html), Maximum sum subarray of size K (Coding%20Problems/Maximum%20sum%20subarray%20of%20size%20K%20757044c706ac49329cbb2d881a8b7edb.html), Find Maximum in Sliding Window (Coding%20Problems/Find%20Maximum%20in%20Sliding%20Window%201636e5cad37542a59d50f4235dd37f86.html), Minimum Window Subsequence (Coding%20Problems/Minimum%20Window%20Subsequence%20f366017db2aa4db982de611d1f9528b2.html)",,"July 4, 2024 3:38 PM",,https://www.educative.io/module/page/jvPPvMJ2Z8LsZol1rNNRXK/5864882417434624/5917419999723520/5165944114642944,,"July 12, 2024 11:30 AM",,,Not started,Not started,,,,,
Custom Data structures,,,,"Snapshot Array (Coding%20Problems/Snapshot%20Array%20058848050c2b46b2987e2733befa57eb.html), Time-Based Key-Value Store (Coding%20Problems/Time-Based%20Key-Value%20Store%2013317537d501480886c2b077242ee77b.html), Implement LRU Cache (Coding%20Problems/Implement%20LRU%20Cache%20c5fc03eda45240a8af71d0b6826c2c24.html), Insert Delete GetRandom O(1) (Coding%20Problems/Insert%20Delete%20GetRandom%20O(1)%20882a34b914ec49639d33f39dc46c3f34.html)",,"July 22, 2024 11:41 AM",,,,"July 22, 2024 11:42 AM",,,Not started,Not started,,,,,
Subsets,,,,"Permutations (Coding%20Problems/Permutations%202ce8f342e4e74afb9bb03ec4a3d9d349.html), Letter Combinations of a Phone Number (Coding%20Problems/Letter%20Combinations%20of%20a%20Phone%20Number%206b2c251541ad4ad0ab244bb6cc9664f2.html), Generate Parentheses (Coding%20Problems/Generate%20Parentheses%20397c1893cef84ae198716d7699ef5ef7.html)",,"July 24, 2024 3:25 PM","
• Requirement for combinations or subsets: The problem asks us to generate combinations (or subsets) of the elements from the input data structure. This could be the final solution itself or a step toward reaching the solution.",,,"October 7, 2024 12:28 PM",,,Not started,Not started,,,,,
Trie,,"Many problems in the real world use the trie pattern. Let’s look at some examples.
• Autocomplete system: One of the most common applications of trie is the autocomplete system in search engines, such as Google. This is the feature that prompts the search engine to give us some suggestions to complete our query when we start typing something in the search bar. These suggestions are given based on common queries that users have searched already that match the prefix we have typed.
• Orthographic corrector: Ever seen pop-up suggestions or red lines under a word while typing a message? That’s an orthographic corrector making suggestions and pointing out spelling mistakes by searching through a dictionary. It uses a trie data structure for efficient searches and retrievals from the available database.
• Prefix matching in IP addresses or URLs: By storing IP prefixes or URL paths in a trie, firewalls and security devices can quickly match incoming traffic against a set of allowed or blocked prefixes for filtering purposes.",,"Search Suggestions System (Coding%20Problems/Search%20Suggestions%20System%20a5dfa5b86e334f8eb9dfc984631c9d95.html), Replace Words (Coding%20Problems/Replace%20Words%20cc1d188dd0634e4ab3eb8d4db82953fc.html), Word Search 2 (Coding%20Problems/Word%20Search%202%201046ac92bcc1802cb723ec5e6726ec94.html)",,"September 2, 2024 2:51 PM","Yes, if either of these conditions is fulfilled:
• Partial matches: We need to compare two strings to detect partial matches based on the initial characters of one or both strings.
• Space optimization: We wish to optimize the space used to store a dictionary of words. Storing shared prefixes once allows for significant savings.
• Can break down the string: The problem statement allows us to break down the strings into individual characters.",https://www.educative.io/module/page/jvPPvMJ2Z8LsZol1rNNRXK/5864882417434624/5917419999723520/5974239514591232,,"September 4, 2024 11:55 AM",,,Not started,Not started,,,,,
Dynamic Programming,,,,"Coin Change (Coding%20Problems/Coin%20Change%20f4f6440266e84986b4c59d60232594c6.html), N-th Tribonacci Number (Coding%20Problems/N-th%20Tribonacci%20Number%2010c6ac92bcc180f5b9dccd269688c94b.html), Counting Bits (Coding%20Problems/Counting%20Bits%2010c6ac92bcc1800b9c8ef33f17b321af.html), 0/1 Knapsack (Coding%20Problems/0%201%20Knapsack%2010c6ac92bcc180119893efceffbd2fb0.html), Word Break II (Coding%20Problems/Word%20Break%20II%201186ac92bcc1800e87b9de28a92c2f2f.html)",,"September 13, 2024 1:35 PM",,,,"October 17, 2024 3:04 PM",,,Not started,Not started,,,,,
Topological Sort,"Topological sorting is a technique used to organize a collection of items or tasks based on their dependencies. 

Imagine there is a list of tasks to complete, but some tasks can only be done after others are finished. There are many such tasks that depend on each other, or there’s a specific sequence of actions that must be followed.

 For example, when baking a cake, there are several steps one needs to follow, and some steps depend on others. We can’t frost the cake until it’s baked, and we can’t bake it until we’ve mixed the batter. To ensure that we don’t frost the cake before baking it or mix the batter after preheating the oven, we need to sort the steps based on their dependencies. 

This is where topological sorting helps us. It figures out the correct sequence of steps to bake the cake efficiently
",,,"Verifying an Alien Dictionary (Coding%20Problems/Verifying%20an%20Alien%20Dictionary%201066ac92bcc180adba99ffd99cbf10b9.html), Compilation Order (Coding%20Problems/Compilation%20Order%201066ac92bcc180cba85bd0e16eaf1f44.html), Course Schedule II (Coding%20Problems/Course%20Schedule%20II%2075e98732275842089fbe938b96a1ab18.html), Alien Dictionary (Coding%20Problems/Alien%20Dictionary%2010b6ac92bcc180dab90cff390730fca0.html)",,"September 19, 2024 12:46 AM",,https://www.educative.io/module/page/jvPPvMJ2Z8LsZol1rNNRXK/5864882417434624/5917419999723520/5417362091278336,"These elements can be represented as the nodes of a graph, so in technical terms, topological sort is a way of ordering the nodes of a directed graph such that for every directed edge [a,b][a,b] from node aa to node bb, aa comes before bb in the ordering.","September 19, 2024 9:41 AM",,,Not started,Not started,,,,"The topological sort pattern is used to find valid orderings of elements that have dependencies on or priority over each other. 

Note: Topological sort is only applicable to directed acyclic graphs (DAGs), meaning there should be no cycles present in the graph.",
Inverted Index Patterns,,"The algorithm's structure is analogous to how search engines like Google or Elasticsearch handle indexing and querying:

1. Index phase: Crawl and tokenize documents, creating an inverted index of terms to document IDs.
2. Query phase: Match user queries to the index and return results efficiently.",,,,"January 18, 2025 2:50 PM",,,"Key Features of the Pattern

• Preprocessing Phase:
    ◦ The algorithm preprocesses the input (A commands) by building the keywordIndex that links keywords (or phrases) to log entries.
    ◦ Each log entry is tokenized into individual keywords and optionally stored as a compound phrase.

• Query Phase:
    ◦ The algorithm uses the inverted index to quickly retrieve relevant logs for a Q command by looking up keywords or phrases.
    ◦ For compound queries, it filters the results to ensure all query terms are present.","January 18, 2025 2:53 PM",,,Not started,Not started,,,,"Definition: An inverted index maps content (e.g., keywords or phrases) to locations where that content appears (e.g., log entries or documents).

Purpose: Quickly find all occurrences of a given term or combination of terms.
In this algorithm:

The keywordIndex acts as an inverted index, mapping keywords (or compound phrases) to the indices of log entries containing them.

This enables efficient querying of logs based on keywords or phrases.",